kind,old_url,old_path,proposed_new_path,action,title,meta_description,h1,word_count,schema_types,decision_note
page,https://hometownpaintingokc.com/,/,/,keep,Trusted Painters In OKC | 120+ 5-Star Reviews | Hometown Painting,"Oklahoma City's trusted residential painters. 120+ perfect 5-star reviews, 5-year written warranty, on-the-spot estimates. Serving Yukon, Mustang, Edmond & OKC metro.",Professional Painters OKC Homeowners Trust,2355,Article;HousePainter;ImageObject;Organization;Person;Place;VideoObject;WebPage;WebSite,Preserve 1:1
page,https://hometownpaintingokc.com/blog/,/blog/,/blog/,keep,Blog | House Painters In The OKC Metro,"Have you ever had a question about which paint to use or how the process works? In our blog, we attempt to answer your questions about painting and staining.",Everything You Want to Know About Painting in OKC,1362,Article;HousePainter;ImageObject;Organization;Person;Place;WebPage;WebSite,Preserve 1:1
page,https://hometownpaintingokc.com/cabinet-painting-okc/,/cabinet-painting-okc/,/cabinet-painting-okc/,keep,Cabinet Painting OKC | House Painters In The OKC Metro,Professional cabinet painters in OKC. Hometown Painting transforms kitchens with expert finishes and lasting quality. Get a free quote today.,Cabinet Painting OKC,717,Article;HousePainter;ImageObject;Organization;Person;Place;WebPage;WebSite,Preserve 1:1
page,https://hometownpaintingokc.com/commercial-painters-oklahoma-city/,/commercial-painters-oklahoma-city/,/commercial-painters-oklahoma-city/,keep,Commercial Painters Oklahoma City | House Painters In The OKC Metro,"A Local, Professional Painting Company in OKC",Oklahoma City’s Trusted Commercial Painters,746,Article;HousePainter;ImageObject;Organization;Person;Place;WebPage;WebSite,Preserve 1:1
page,https://hometownpaintingokc.com/contact-us/,/contact-us/,/contact-us/,keep,Contact Us | Hometown Painting LLC,"To request a free estimate for your next painting project, please fill out the form below.",Get In Touch With Hometown Painting,212,Article;ContactPage;HousePainter;ImageObject;Organization;Person;Place;VideoObject;WebSite,Preserve 1:1
page,https://hometownpaintingokc.com/disclaimer/,/disclaimer/,/disclaimer/,keep,Disclaimer For Hometown Painting | House Painters In The OKC Metro,"If you require any more information or have any questions about our site's disclaimer, please feel free to contact us by email at matt@hometownpaintingokc.com",Disclaimer for Hometown Painting,364,Article;HousePainter;ImageObject;Organization;Person;Place;WebPage;WebSite,Preserve 1:1
page,https://hometownpaintingokc.com/exterior-painting-oklahoma-city/,/exterior-painting-oklahoma-city/,/exterior-painting-oklahoma-city/,keep,BEST Exterior Painters In Town | Exterior Painting Oklahoma City,We provide exterior painting Oklahoma City can trust. Exterior house painting is a must to protect your home from the OKC weather. 5 Year warranty on our exterior work!,Exterior Painting Oklahoma City Homeowners can trust,1538,Article;HousePainter;ImageObject;Organization;Person;Place;VideoObject;WebPage;WebSite,Preserve 1:1
page,https://hometownpaintingokc.com/exterior-painting/,/exterior-painting/,/exterior-painting/,keep,Exterior Painting Landing Page | House Painters In The OKC Metro,Get a Free Estimate,Professional Exterior Painting in Oklahoma City,515,Article;HousePainter;ImageObject;Organization;Person;Place;VideoObject;WebPage;WebSite,Preserve 1:1
page,https://hometownpaintingokc.com/exterior-painting/deck-staining-okc-professional-deck-staining-services-in-oklahoma-city/,/exterior-painting/deck-staining-okc-professional-deck-staining-services-in-oklahoma-city/,/deck-staining-okc/,301,Deck Staining OKC | Professional Deck Staining Services In Oklahoma City | House Painters In The OKC Metro,"Professional deck staining services in Oklahoma City. Transform your weathered deck with premium stains, expert application, and lasting protection. Free consultation available.",Deck Staining OKC | Professional Deck Staining Services in Oklahoma City,1041,Article;HousePainter;ImageObject;Organization;Person;Place;WebPage;WebSite,"REVIEW: duplicate deck page; consolidate into one deck page, 301 old"
page,https://hometownpaintingokc.com/exterior-painting/deck-staining-okc-professional-deck-staining-services-in-oklahoma-city/professional-deck-staining-okc-hometown-painting-oklahoma-city/,/exterior-painting/deck-staining-okc-professional-deck-staining-services-in-oklahoma-city/professional-deck-staining-okc-hometown-painting-oklahoma-city/,/deck-staining-okc/,301,Professional Deck Staining OKC | Hometown Painting Oklahoma City | House Painters In The OKC Metro,"Your deck is one of the most valuable outdoor investments in your home. Whether you're looking to restore a weathered deck or protect a newly built one,",Professional Deck Staining OKC | Hometown Painting Oklahoma City,1459,Article;HousePainter;ImageObject;Organization;Person;Place;WebPage;WebSite,"REVIEW: deeply-nested duplicate deck page; consolidate into one deck page, 301 old"
page,https://hometownpaintingokc.com/fence-staining-okc/,/fence-staining-okc/,/fence-staining-okc/,keep,#1 Fence Staining OKC- Free Estimates In Oklahoma City,Hometown Painting LLC offers fence staining in the OKC metro area. Fence staining OKC is the best way to make your fence look beautiful and last longer.,Fence Staining OKC can Trust.,2057,Article;HousePainter;ImageObject;Organization;Person;Place;VideoObject;WebPage;WebSite,Preserve 1:1
page,https://hometownpaintingokc.com/gallery/,/gallery/,/gallery/,keep,See Our Work In The OKC Metro,See pictures of homes we have painted in Oklahoma City and the surrounding community. We have pictures of interior and exterior projects.,Take a Look at Our Work,182,Article;HousePainter;ImageObject;Organization;Person;Place;WebPage;WebSite,Preserve 1:1
page,https://hometownpaintingokc.com/house-painting-contractors-okc-professional-painters-oklahoma-city/,/house-painting-contractors-okc-professional-painters-oklahoma-city/,/house-painting-contractors-okc-professional-painters-oklahoma-city/,keep,House Painting Contractors OKC | Professional Painters Oklahoma City | House Painters In The OKC Metro,"Welcome to Hometown Painting OKC, your premier destination for professional house painting contractors in Oklahoma City. With years of dedicated service to",House Painting Contractors OKC | Professional Painters Oklahoma City,1051,Article;HousePainter;ImageObject;Organization;Person;Place;WebPage;WebSite,Preserve 1:1
page,https://hometownpaintingokc.com/interior-painting-okc/,/interior-painting-okc/,/interior-painting-okc/,keep,TOP RATED Interior Painting In Oklahoma City | OKC Metro,You will love the look of your home. We offer Interior painting in Oklahoma City that can transform your interior space.,Interior Painting Oklahoma City can Trust,1622,Article;HousePainter;ImageObject;Organization;Person;Place;VideoObject;WebPage;WebSite,Preserve 1:1
page,https://hometownpaintingokc.com/interior-painting/,/interior-painting/,/interior-painting/,keep,Interior Painting Landing Page | House Painters In The OKC Metro,Get a Free Estimate,Professional Interior Painters in the OKC Metro,468,Article;HousePainter;ImageObject;Organization;Person;Place;VideoObject;WebPage;WebSite,Preserve 1:1
page,https://hometownpaintingokc.com/link-tree/,/link-tree/,/link-tree/,keep,Link Tree | House Painters In The OKC Metro,Welcome to Our Client Resources. Explore & Learn More About Hometown Painting!,,104,Article;HousePainter;ImageObject;Organization;Person;Place;WebPage;WebSite,Preserve 1:1
page,https://hometownpaintingokc.com/mesta-park/,/mesta-park/,/mesta-park/,keep,Mesta Park | Interior And Exterior Painting,"Learn more about our interior and exterior painting projects in the historic Mesta Park neighborhood in Oklahoma City, OK",Professional House Painters in the Mesta Park neighborhood.,528,Article;HousePainter;ImageObject;Organization;Person;Place;WebPage;WebSite,Preserve 1:1
page,https://hometownpaintingokc.com/okc-fence-stain-colors/,/okc-fence-stain-colors/,/okc-fence-stain-colors/,keep,Wood Defender Fence Stain Colors | Top OKC Colors,These are the top fence stain colors available in the OKC metro area. Fence Staining can make your outdoor space beautiful and inviting. For Cedar or treated wood.,Wood Defender Oil-Based Fence stain colors available in the OKC Metro,450,Article;HousePainter;ImageObject;Organization;Person;Place;WebPage;WebSite,Preserve 1:1
page,https://hometownpaintingokc.com/painters-bethany-ok/,/painters-bethany-ok/,/painters-bethany-ok/,keep,Top Rated House Local Painters In Bethany Oklahoma,"We make it easy for you to transform your home with a fresh coat of paint. We offer free estimates to all our Bethany, OK customers. Locally owned company.",Enhance your home with New paint inside and out,490,Article;HousePainter;ImageObject;Organization;Person;Place;WebPage;WebSite,Preserve 1:1
page,https://hometownpaintingokc.com/painters-edmond-ok/,/painters-edmond-ok/,/painters-edmond-ok/,keep,"House Painters In Edmond, OK | Interior And Exterior Paint","We can help you transform your Edmond home with luxurious paint. Whether it's your interior or exterior, we can give you a hassle-free painting experience.",Edmond OK,766,Article;HousePainter;ImageObject;Organization;Person;Place;WebPage;WebSite,Preserve 1:1
page,https://hometownpaintingokc.com/painters-mustang-ok/,/painters-mustang-ok/,/painters-mustang-ok/,keep,Top Painters Mustang OK | 5 Star Rated | Free Estimates,Painters Mustang OK Hometown Painting LLC offers interior and exterior painting in Mustang OK. Free estimates. Discounts for military and first responders,fresh paint makes your home beautiful and Inviting,768,Article;HousePainter;ImageObject;Organization;Person;Place;VideoObject;WebPage;WebSite,Preserve 1:1
page,https://hometownpaintingokc.com/painters-yukon-ok/,/painters-yukon-ok/,/painters-yukon-ok/,keep,"5 Star Rated |House Painters Yukon, OK | Free Estimates","Hometown Painting LLC: The Painters Yukon, OK Homeowners Trust. We offer Interior and Exterior Painting. Free Estimates. Military and First Responder Discounts.",House Painters Yukon OK Homeowners Trust,607,Article;HousePainter;ImageObject;Organization;Person;Place;WebPage;WebSite,Preserve 1:1
page,https://hometownpaintingokc.com/painters/,/painters/,/painters/,keep,Painters OKC Landing Page | House Painters In The OKC Metro,Get a Free Estimate,Professional local Painters in the OKC Metro,434,Article;HousePainter;ImageObject;Organization;Person;Place;VideoObject;WebPage;WebSite,Preserve 1:1
page,https://hometownpaintingokc.com/painting-estimate/,/painting-estimate/,/painting-estimate/,keep,Free Painting Estimates In Oklahoma City,Request a Free Estimate!,Premium Home Painting in Oklahoma City,260,Article;HousePainter;ImageObject;Organization;Person;Place;VideoObject;WebPage;WebSite,Preserve 1:1
page,https://hometownpaintingokc.com/pergola-staining-okc/,/pergola-staining-okc/,/pergola-staining-okc/,keep,Top Pergola Staining In OKC | Protect Your Pergola Today,"For a fresh, new look, discover why we're the choice for pergola staining Oklahoma City residents recommend.",Pergola Staining OKC Homeowners Can Trust,1297,Article;HousePainter;ImageObject;Organization;Person;Place;WebPage;WebSite,Preserve 1:1
page,https://hometownpaintingokc.com/pricing/,/pricing/,/pricing/,keep,Pricing | House Painters In The OKC Metro,"Transparency: We want you to be as well-informed as possible about your next paint job, including the project's potential cost.",What Will Your Next Paint Job Cost?,749,Article;HousePainter;ImageObject;Organization;Person;Place;WebPage;WebSite,Preserve 1:1
page,https://hometownpaintingokc.com/pricing/exterior-painting-cost-oklahoma-city/,/pricing/exterior-painting-cost-oklahoma-city/,/pricing/exterior-painting-cost-oklahoma-city/,keep,Exterior Painting Cost In Oklahoma City | 2026 Guide,"Exterior painting cost in Oklahoma City explained with real price ranges, what affects the cost, and how to budget. Get a clear, local breakdown before you repaint.",Exterior Painting Cost in Oklahoma City: What Homeowners Really Pay,945,Article;HousePainter;ImageObject;Organization;Person;Place;WebPage;WebSite,Preserve 1:1
page,https://hometownpaintingokc.com/pricing/interior-pricing/,/pricing/interior-pricing/,/pricing/interior-pricing/,keep,Interior Pricing | House Painters In The OKC Metro,"Every homeowner dreams of a stunning interior, a backdrop worthy of every life event and quiet moment. While the idea of painting can seem daunting,",,674,Article;HousePainter;ImageObject;Organization;Person;Place;WebPage;WebSite,Preserve 1:1
page,https://hometownpaintingokc.com/privacy-policy/,/privacy-policy/,/privacy-policy/,keep,Privacy Policy,"In Short: If you are a resident of California, Colorado, Connecticut, Delaware, Florida, Indiana, Iowa, Kentucky, Maryland, Minnesota, Montana, Nebraska, New",Privacy Policy for Hometown Painting,5667,Article;HousePainter;ImageObject;Organization;Person;Place;WebPage;WebSite,Preserve 1:1
page,https://hometownpaintingokc.com/professional-drywall-repair-oklahoma-city-hometown-painting-okc/,/professional-drywall-repair-oklahoma-city-hometown-painting-okc/,/professional-drywall-repair-oklahoma-city-hometown-painting-okc/,keep,Professional Drywall Repair Oklahoma City | Hometown Painting OKC | House Painters In The OKC Metro,"At Hometown Painting OKC, we understand that damaged drywall can significantly impact the appearance and value of your property. Whether you're dealing with",Professional Drywall Repair Oklahoma City | Hometown Painting OKC,923,Article;HousePainter;ImageObject;Organization;Person;Place;WebPage;WebSite,Preserve 1:1
page,https://hometownpaintingokc.com/professional-painters-okc/,/professional-painters-okc/,/professional-painters-okc/,keep,Professional Painters OKC | Hometown Painting LLC,Hometown Painting LLC are your professional painters in the OKC Metro area. We specialize in residential painting. We can make your home look great!,A Tradition of Professional Painters in OKC,652,AboutPage;HousePainter;ImageObject;Organization;Place;WebSite,Preserve 1:1
page,https://hometownpaintingokc.com/professional-painters-okc/warranty/,/professional-painters-okc/warranty/,/professional-painters-okc/warranty/,keep,Hometown Painting Warranty | House Painters In The OKC Metro,"In order to help our customers to the best of our ability, Hometown Painting offers a warranty on their painting work. While we do our best to provide great",Hometown Painting Warranty,396,Article;HousePainter;ImageObject;Organization;Person;Place;WebPage;WebSite,Preserve 1:1
page,https://hometownpaintingokc.com/professional-pressure-washing-oklahoma-city-hometown-painting-okc/,/professional-pressure-washing-oklahoma-city-hometown-painting-okc/,/professional-pressure-washing-oklahoma-city-hometown-painting-okc/,keep,Professional Pressure Washing Oklahoma City | Hometown Painting OKC | House Painters In The OKC Metro,"When it comes to maintaining the exterior of your home or business in Oklahoma City, few services are as effective and transformative as professional pressure",Professional Pressure Washing Oklahoma City | Hometown Painting OKC,1470,Article;HousePainter;ImageObject;Organization;Person;Place;WebPage;WebSite,Preserve 1:1
page,https://hometownpaintingokc.com/reviews/,/reviews/,/reviews/,keep,Reviews | House Painters In The OKC Metro,Strong local businesses build the strong community we all love and enjoy.,Do You Love To Support Local Businesses?,190,Article;HousePainter;ImageObject;Organization;Person;Place;WebPage;WebSite,Preserve 1:1
page,https://hometownpaintingokc.com/terms-conditions/,/terms-conditions/,/terms-conditions/,keep,Terms And Conditions | House Painters In The OKC Metro,Welcome to Hometown Painting!,Terms and Conditions,1581,Article;HousePainter;ImageObject;Organization;Person;Place;WebPage;WebSite,Preserve 1:1
page,https://hometownpaintingokc.com/thank-you/,/thank-you/,/thank-you/,keep,You Requested A Free Quote | House Painters In The OKC Metro,"We look forward to working with you on your project! If you were able to get an appointment scheduled on our calendar already, Great! If not there is a link",Thank you for Requesting Your Estimate!,138,Article;HousePainter;ImageObject;Organization;Person;Place;WebPage;WebSite,Preserve 1:1
page,https://hometownpaintingokc.com/wall-painting-okc/,/wall-painting-okc/,/wall-painting-okc/,keep,See What Wall Painting Can Do For Your OKC Home,The wall color of your home makes a huge statement. Does your home say what you want it to? Wall painting can give your home the voice you want it to share.,Wall Painting in the OKC Metro,287,Article;HousePainter;ImageObject;Organization;Person;Place;WebPage;WebSite,Preserve 1:1
post,https://hometownpaintingokc.com/best-exterior-paint-oklahoma-weather/,/best-exterior-paint-oklahoma-weather/,/best-exterior-paint-oklahoma-weather/,keep,Best Exterior Paints For Oklahoma Weather | 2026 Guide,"Learn the best exterior paints and primers for Oklahoma’s heat, sun, wind, and storms. Includes Sherwin-Williams and Benjamin Moore options recommended by pros.",Best Exterior Paints and Primers for Oklahoma Weather,1128,BlogPosting;HousePainter;ImageObject;Organization;Person;Place;WebPage;WebSite,Preserve 1:1
post,https://hometownpaintingokc.com/best-time-of-year-paint-exterior-oklahoma/,/best-time-of-year-paint-exterior-oklahoma/,/best-time-of-year-paint-exterior-oklahoma/,keep,Best Time Of Year To Paint Your Exterior In Oklahoma,"Learn the best time of year to paint your home’s exterior in Oklahoma. Understand temperature, humidity, and seasonal weather so your paint job lasts longer.",Best Time of Year to Paint Your Home’s Exterior in Oklahoma,1540,BlogPosting;HousePainter;ImageObject;Organization;Person;Place;WebPage;WebSite,Preserve 1:1
post,https://hometownpaintingokc.com/brick-painting-okc/,/brick-painting-okc/,/brick-painting-okc/,keep,Exterior Brick Painting | Transform Your OKC Home's Exterior,Painting your home's brick is a quick way to make a dramatic transformation. Learn about the benefits of brick painting and the best products and techniques.,Painting Exterior Brick in OKC,1104,BlogPosting;HousePainter;ImageObject;Organization;Person;Place;VideoObject;WebPage;WebSite,Preserve 1:1
post,https://hometownpaintingokc.com/can-a-gray-fence-or-deck-be-stained/,/can-a-gray-fence-or-deck-be-stained/,/can-a-gray-fence-or-deck-be-stained/,keep,Can A Gray Fence Or Deck Be Stained? | House Painters In The OKC Metro,If you have an older fence or deck that has turned gray you may think it is too late to have beautifully stained wood in your backyard. The truth is that,Can a Gray Fence or Deck be Stained?,1254,BlogPosting;HousePainter;ImageObject;Organization;Person;Place;WebPage;WebSite,Preserve 1:1
post,https://hometownpaintingokc.com/choosing-exterior-paint-colors/,/choosing-exterior-paint-colors/,/choosing-exterior-paint-colors/,keep,Choosing The Best Exterior Paint Colors For Your Home,"Choosing the best exterior paint color for your home can seem challenging. With these easy steps, you can be confident choosing exterior paint colors.",How to pick an Exterior Paint Color,1067,BlogPosting;HousePainter;ImageObject;Organization;Person;Place;WebPage;WebSite,Preserve 1:1
post,https://hometownpaintingokc.com/commercial-painting-in-yukon-ok-victory-baptist-church/,/commercial-painting-in-yukon-ok-victory-baptist-church/,/commercial-painting-in-yukon-ok-victory-baptist-church/,keep,"Commercial Painting In Yukon, OK: Victory Baptist Church | House Painters In The OKC Metro","The exterior of a commercial building is the first impression people will have of the business or organization. Unfortunately, the exterior of the Victory","Commercial Painting in Yukon, OK: Victory Baptist Church",610,BlogPosting;HousePainter;ImageObject;Organization;Person;Place;WebPage;WebSite,Preserve 1:1
post,https://hometownpaintingokc.com/cost-to-stain-a-fence-okc/,/cost-to-stain-a-fence-okc/,/cost-to-stain-a-fence-okc/,keep,Average Cost To Stain A Fence In OKC | 2022 Cost Guide,Wonder if you're paying too much? We will give you a breakdown of the average cost to stain a fence in the OKC metro area. Includes different stain types.,What is the Average Cost To Stain a Fence in the OKC Metro?,1164,BlogPosting;HousePainter;ImageObject;Organization;Person;Place;WebPage;WebSite,Preserve 1:1
post,https://hometownpaintingokc.com/exterior-lime-wash-edmond-ok/,/exterior-lime-wash-edmond-ok/,/exterior-lime-wash-edmond-ok/,keep,Exterior Lime Wash In Edmond OK - Modernize Your Home Fast,Lime Wash is the perfect way to completely update the look and feel of your home. The perfect vibe for Edmond OK.,A Complete New Look: Exterior Lime Wash in Edmond OK,764,BlogPosting;HousePainter;ImageObject;Organization;Person;Place;WebPage;WebSite,Preserve 1:1
post,https://hometownpaintingokc.com/exterior-painting-prep-work-oklahoma-city/,/exterior-painting-prep-work-oklahoma-city/,/exterior-painting-prep-work-oklahoma-city/,keep,Exterior Prep Work For Painting In Oklahoma City,"Learn what professional exterior prep work includes in Oklahoma City—washing, scraping, sanding, priming, caulking, and repairs for a long-lasting paint job.",What’s Included in Professional Exterior Prep Work?,1156,BlogPosting;HousePainter;ImageObject;Organization;Person;Place;WebPage;WebSite,Preserve 1:1
post,https://hometownpaintingokc.com/how-long-does-outdoor-stain-last/,/how-long-does-outdoor-stain-last/,/how-long-does-outdoor-stain-last/,keep,How Long Does Outdoor Stain Last In OKC? | Expert Advice,How long does fence or deck stain last in Oklahoma City? Find out the key factors that affect the longevity of a stain job and how to choose the best stain.,How Long Does Outdoor Stain Last in OKC?,834,BlogPosting;HousePainter;ImageObject;Organization;Person;Place;WebPage;WebSite,Preserve 1:1
post,https://hometownpaintingokc.com/how-often-repaint-oklahoma-city/,/how-often-repaint-oklahoma-city/,/how-often-repaint-oklahoma-city/,keep,How Often Should You Repaint Your House In Oklahoma City?,Learn the signs that it's time to repaint your house. Discover how Oklahoma City's unique climate impacts the longevity of your home's exterior paint job.,How Often Should You Repaint Your House in Oklahoma City?,1313,BlogPosting;HousePainter;ImageObject;Organization;Person;Place;WebPage;WebSite,Preserve 1:1
post,https://hometownpaintingokc.com/how-to-choose-a-fence-stain-color/,/how-to-choose-a-fence-stain-color/,/how-to-choose-a-fence-stain-color/,keep,How To Chooose A Fence Stain Color | 2022 Color Guide,Fence stain comes in a wide variety of colors. How can you know the best option to choose for your home? We have created a handy guide to help you select the perfect shade.,How to choose a fence stain color,1013,BlogPosting;HousePainter;ImageObject;Organization;Person;Place;WebPage;WebSite,Preserve 1:1
post,https://hometownpaintingokc.com/how-to-choose-exterior-paint-colors-for-your-oklahoma-home/,/how-to-choose-exterior-paint-colors-for-your-oklahoma-home/,/how-to-choose-exterior-paint-colors-for-your-oklahoma-home/,keep,How To Choose Exterior Paint Colors For Your Oklahoma Home | House Painters In The OKC Metro,Choosing exterior paint colors can feel overwhelming. Walk into any paint store and you're staring at thousands of options. Add in the fact that this decision,How to Choose Exterior Paint Colors for Your Oklahoma Home,1282,BlogPosting;HousePainter;ImageObject;Organization;Person;Place;WebPage;WebSite,Preserve 1:1
post,https://hometownpaintingokc.com/how-to-choose-the-best-sheen-or-gloss/,/how-to-choose-the-best-sheen-or-gloss/,/how-to-choose-the-best-sheen-or-gloss/,keep,How To Choose The Best Sheen Or Gloss,Choosing the right finish for each type of paint in your home in an important step when planning a paint project. The many options available can seem,How To Choose The Best Sheen Or Gloss,887,BlogPosting;HousePainter;ImageObject;Organization;Person;Place;WebPage;WebSite,Preserve 1:1
post,https://hometownpaintingokc.com/is-spraying-or-rolling-better/,/is-spraying-or-rolling-better/,/is-spraying-or-rolling-better/,keep,Spray Vs. Rolling Exterior Paint | Which Is Better?,"If you're looking to get the best pain job on your home's exterior, should you spray or roll? We will discuss the pros and cons of each.",Spray vs Roll for exterior painting,696,BlogPosting;HousePainter;ImageObject;Organization;Person;Place;WebPage;WebSite,Preserve 1:1
post,https://hometownpaintingokc.com/paint-colors-that-make-your-home-relaxing/,/paint-colors-that-make-your-home-relaxing/,/paint-colors-that-make-your-home-relaxing/,keep,Paint Colors That Make Your Home Relaxing,Choosing the right paint colors can make your home a serene refuge for you and your family. Learn how to choose the best relaxing color palette for your home.,Paint Colors for a Relaxing Home,1194,BlogPosting;HousePainter;ImageObject;Organization;Person;Place;WebPage;WebSite,Preserve 1:1
post,https://hometownpaintingokc.com/painting-metal-siding-on-an-oklahoma-city-shop/,/painting-metal-siding-on-an-oklahoma-city-shop/,/painting-metal-siding-on-an-oklahoma-city-shop/,keep,Painting Metal Siding On An Oklahoma City Shop | House Painters In The OKC Metro,Hi there! We at Hometown Painting LLC recently finished a project that we're really excited to share. It's about painting metal siding on a metal shop,Painting Metal Siding on an Oklahoma City Shop,1059,BlogPosting;HousePainter;ImageObject;Organization;Person;Place;WebPage;WebSite,Preserve 1:1
